{"acceptance_run_sha256":"dcc685f971864fc4a9b3fb04a85128e78538e6d944ab0b69b16e7f84a9d7d5a3","aggregate_id":"aggregate-00000000-0000-4000-8000-000000000001","cross_domain_e2e":{"reason":"transport_qualification_not_provided","status":"unevaluated"},"generated_at":"2026-07-26T12:02:00Z","per_domain_aggregate":"passed","per_domain_results":[{"domain_id":"primary","result_id":"result-01234567-89ab-4def-8123-456789abcdef","result_sha256":"f1f0a13527be7716ea7a883e24c8a2d25da1fb51339dfc44b00234078b055a1e","status":"passed"}],"run_id":"run-10000000-0000-4000-8000-000000000001","schema_version":"acceptance-aggregate.v1"}
